{
  "$schema": "https://json-schema.org/draft/2020-12/schema",
  "$id": "https://raw.githubusercontent.com/cre8/catalog-of-attestations/main/catalog.schema.json",
  "title": "SchemaMeta",
  "description": "A common attestation schema data model, aligned with EUDI TS11 specification.",
  "type": "object",
  "properties": {
    "id": {
      "type": "string",
      "format": "uuid",
      "description": "The unique, server-assigned identifier (UUID) for the schema."
    },
    "version": {
      "type": "string",
      "description": "Version of this attestation definition (SemVer).",
      "pattern": "^(0|[1-9]\\d*)\\.(0|[1-9]\\d*)\\.(0|[1-9]\\d*)(?:-[0-9A-Za-z-.]+)?(?:\\+[0-9A-Za-z-.]+)?$"
    },
    "rulebookURI": {
      "type": "string",
      "description": "URI of the human-readable Attestation Rulebook, optionally with an SRI integrity fragment.",
      "format": "uri"
    },
    "trustedAuthorities": {
      "type": "array",
      "description": "Trust frameworks / trust anchors applicable to this attestation type.",
      "items": {
        "$ref": "#/$defs/TrustAuthority"
      }
    },
    "attestationLoS": {
      "type": "string",
      "description": "Level of security (LoS) of this attestation.",
      "enum": [
        "iso_18045_high",
        "iso_18045_moderate",
        "iso_18045_enhanced-basic",
        "iso_18045_basic"
      ]
    },
    "bindingType": {
      "type": "string",
      "description": "Required binding type between attestation and holder.",
      "enum": [
        "claim",
        "key",
        "biometric",
        "none"
      ]
    },
    "supportedFormats": {
      "type": "array",
      "description": "Credential formats in which this attestation is available.",
      "items": {
        "type": "string",
        "enum": [
          "dc+sd-jwt",
          "mso_mdoc",
          "jwt_vc_json",
          "jwt_vc_json-ld",
          "ldp_vc"
        ]
      },
      "minItems": 1,
      "uniqueItems": true
    },
    "schemaURIs": {
      "type": "array",
      "description": "Format-specific schema URIs for this attestation type.",
      "items": {
        "$ref": "#/$defs/Schema"
      },
      "minItems": 1
    }
  },
  "required": [
    "version",
    "rulebookURI",
    "attestationLoS",
    "bindingType",
    "supportedFormats",
    "schemaURIs"
  ],
  "additionalProperties": false,

  "$defs": {
    "Schema": {
      "type": "object",
      "description": "Format-specific schema descriptor for the attestation.",
      "properties": {
        "formatIdentifier": {
          "type": "string",
          "description": "The credential format identifier.",
          "enum": [
            "dc+sd-jwt",
            "mso_mdoc",
            "jwt_vc_json",
            "jwt_vc_json-ld",
            "ldp_vc"
          ]
        },
        "uri": {
          "type": "string",
          "description": "Persistent schema URI for this format (may include SRI fragment).",
          "format": "uri"
        }
      },
      "required": ["formatIdentifier", "uri"],
      "additionalProperties": false
    },

    "TrustAuthority": {
      "type": "object",
      "description": "Applicable trust framework and authority/anchor.",
      "properties": {
        "frameworkType": {
          "type": "string",
          "description": "Type of trust framework.",
          "enum": [
            "aki",
            "etsi_tl",
            "openid_federation"
          ]
        },
        "value": {
          "type": "string",
          "description": "Identifier of the authority (AKI, TL URI, or federation entity identifier)."
        },
        "isLoTE": {
          "type": "boolean",
          "description": "TRUE if frameworkType is 'etsi_tl' and the TL is a List of Trusted Entities (LoTE) per ETSI TS 119 602. FALSE if ETSI TS 119 612. Only used with etsi_tl framework type."
        }
      },
      "required": ["frameworkType", "value"],
      "additionalProperties": false
    }
  }
}
